"Name","Internal name","Type","Description","Group name","Form field","Options","Read only value","Read only definition","Calculated","External options","Deleted","Hubspot defined","Created user","Usages","Fill rate","Last Updated Time","Update Source"
"Close date","closed_date","datetime","The date the ticket was closed","ticket_activity","false","","false","true","false","false","false","true","HubSpot","Custom view (1)","20%","",""
"Create date","createdate","datetime","The date the ticket was created","ticket_activity","false","","false","true","false","false","false","true","HubSpot","","100%","",""
"First agent email response date","first_agent_reply_date","datetime","The date of the first email response from an agent after a ticket was created","ticket_activity","false","","true","true","false","false","false","true","HubSpot","","40%","",""
"Last Closed Date","hs_last_closed_date","datetime","The date when ticket was last closed","ticket_activity","false","","false","true","false","false","false","true","HubSpot","","20%","",""
"Last activity date","hs_lastactivitydate","datetime","The last time a note, call, email, meeting, or task was logged for a ticket. This is updated automatically by HubSpot.","ticket_activity","false","","true","true","false","false","false","true","HubSpot","","40%","",""
"Last contacted date","hs_lastcontacted","datetime","The last time a call, chat conversation, LinkedIn message, postal mail, meeting, sales email, SMS, or WhatsApp message was logged for a ticket. This is set automatically by HubSpot based on user actions in the ticket record.","ticket_activity","false","","true","true","false","false","false","true","HubSpot","","40%","",""
"Last modified date","hs_lastmodifieddate","datetime","Most recent timestamp of any property update for this ticket. This includes HubSpot internal properties, which can be visible or hidden. This property is updated automatically.","ticket_activity","false","","true","true","false","false","false","true","HubSpot","","100%","",""
"Next activity date","hs_nextactivitydate","datetime","The date of the next upcoming activity for a ticket. This property is set automatically by HubSpot based on user action. This includes logging a future call, email, or meeting using the Log feature, as well as creating a future task or scheduling a future meeting. This is updated automatically by HubSpot.","ticket_activity","false","","true","true","false","false","false","true","HubSpot","","0%","",""
"Number of times contacted","hs_num_times_contacted","number","The number of times a call, email, or meeting was logged on the ticket","ticket_activity","false","","true","true","false","false","false","true","HubSpot","","100%","",""
"Owner assigned date","hubspot_owner_assigneddate","datetime","The most recent timestamp of when an owner was assigned to this record. This value is set automatically by HubSpot.","ticket_activity","false","","true","true","false","false","false","true","HubSpot","","100%","",""
"Last customer reply date","last_reply_date","datetime","The date of the last customer response","ticket_activity","false","","true","true","false","false","false","true","HubSpot","","40%","",""
"Number of Sales Activities","num_notes","number","The number of times a call, chat conversation, LinkedIn message, postal mail, meeting, note, sales email, SMS, task, or WhatsApp message was logged for a ticket record. This is set automatically by HubSpot based on user actions in the ticket record.","ticket_activity","false","","true","true","false","false","false","true","HubSpot","","40%","",""
"Time to close","time_to_close","number","The time between when the ticket was created and closed","ticket_activity","false","","true","true","false","false","false","true","HubSpot","","20%","",""
"Time to first agent email reply","time_to_first_agent_reply","number","The time from the ticket create date to the first agent email reply","ticket_activity","false","","true","true","false","false","false","true","HubSpot","","40%","",""
"Ticket description","content","string","Description of the ticket","ticketinformation","true","","false","true","false","false","false","true","HubSpot","","80%","",""
"All associated contact emails","hs_all_associated_contact_emails","string","All associated contact emails","ticketinformation","false","","true","true","true","false","false","true","HubSpot","","60%","",""
"Assigned Teams","hs_assigned_team_ids","enumeration","The target main teams or the user's main team assigned to the ticket by automatic assignment.","ticketinformation","false","","true","true","false","true","false","true","HubSpot","","0%","",""
"Created by user ID","hs_created_by_user_id","number","The user who created this record. This value is set automatically by HubSpot.","ticketinformation","false","","true","true","false","true","false","true","HubSpot","","100%","",""
"Customer Agent ticket status","hs_customer_agent_ticket_status","enumeration","Signifies if the Breeze Customer Agent has escalated an issue","ticketinformation","false","None (NONE); Escalated (ESCALATED)","false","false","false","false","false","true","HubSpot","","0%","",""
"File upload","hs_file_upload","string","Files attached to a support form by a contact.","ticketinformation","true","","false","true","false","true","false","true","HubSpot","","0%","",""
"Last message from visitor","hs_last_message_from_visitor","bool","Whether the last message came from visitor","ticketinformation","false","True (true); False (false)","true","true","false","false","false","true","HubSpot","","100%","",""
"Last message received date","hs_last_message_received_at","datetime","The date of the last response from the visitor","ticketinformation","false","","true","true","true","false","false","true","HubSpot","","40%","",""
"Last response date","hs_last_message_sent_at","datetime","The date of the last response from an agent or bot","ticketinformation","false","","true","true","true","false","false","true","HubSpot","","40%","",""
"Latest message is thread comment","hs_latest_message_is_thread_comment","bool","Is latest message a thread comment","ticketinformation","false","Yes (true); No (false)","true","false","false","false","false","true","HubSpot","","40%","",""
"Merged Ticket IDs","hs_merged_object_ids","enumeration","The list of Ticket record IDs that have been merged into this Ticket. This value is set automatically by HubSpot.","ticketinformation","false","","true","true","false","false","false","true","HubSpot","","0%","",""
"Number of Associated Companies","hs_num_associated_companies","number","Number of companies associated with this ticket","ticketinformation","false","","true","true","true","false","false","true","HubSpot","","100%","",""
"Record ID","hs_object_id","number","The unique ID for this record. This value is set automatically by HubSpot.","ticketinformation","false","","true","true","false","false","false","true","HubSpot","","100%","",""
"Record source detail 1","hs_object_source_detail_1","string","First level of detail on how this record was created.","ticketinformation","false","","true","true","false","false","false","true","HubSpot","","0%","",""
"Record source detail 2","hs_object_source_detail_2","string","Second level of detail on how this record was created.","ticketinformation","false","","true","true","false","false","false","true","HubSpot","","0%","",""
"Record source detail 3","hs_object_source_detail_3","string","Third level of detail on how this record was created.","ticketinformation","false","","true","true","false","false","false","true","HubSpot","","0%","",""
"Record source","hs_object_source_label","enumeration","How this record was created.","ticketinformation","false","","true","true","false","true","false","true","HubSpot","","100%","",""
"Originating channel account","hs_originating_channel_instance_id","enumeration","First channel account used when conversation was started","ticketinformation","false","","true","true","true","true","false","true","HubSpot","","40%","",""
"Originating channel type","hs_originating_generic_channel_id","enumeration","The channel the conversation is in","ticketinformation","false","","true","true","true","true","false","true","HubSpot","","40%","",""
"Outbound ticket","hs_outbound_ticket","bool","Was the ticket created by sending an outbound communication from an object record page?","ticketinformation","false","Yes (true); No (false)","true","true","false","false","false","true","HubSpot","","0%","",""
"Pipeline","hs_pipeline","enumeration","The pipeline that contains this ticket","ticketinformation","true","","false","true","false","true","false","true","HubSpot","","100%","",""
"Ticket status","hs_pipeline_stage","enumeration","The pipeline stage that contains this ticket","ticketinformation","true","","false","true","false","true","false","true","HubSpot","","100%","",""
"Resolution","hs_resolution","enumeration","The action taken to resolve the ticket","ticketinformation","true","Issue fixed (ISSUE_FIXED); Feature request tracked (FEATURE_REQUEST_TRACKED); Refund applied (REFUND_APPLIED); Sent knowledge document link (SENT_KNOWLEDGE_DOCUMENT_LINK)","false","true","false","false","false","true","HubSpot","","0%","",""
"Ticket Tags","hs_tag_ids","enumeration","List of tag ids applicable to a ticket. This property is set automatically by HubSpot.","ticketinformation","false","","true","true","false","true","false","true","HubSpot","","0%","",""
"Category","hs_ticket_category","enumeration","Main reason customer reached out for help","ticketinformation","true","Product issue (PRODUCT_ISSUE); Billing issue (BILLING_ISSUE); Feature request (FEATURE_REQUEST); General inquiry (GENERAL_INQUIRY)","false","false","false","false","false","true","HubSpot","","0%","",""
"Ticket ID","hs_ticket_id","number","The unique id for this ticket. This unique id is automatically populated by HubSpot.","ticketinformation","false","","true","true","true","false","false","true","HubSpot","","100%","",""
"Priority","hs_ticket_priority","enumeration","The level of attention needed on the ticket","ticketinformation","true","Low (LOW); Medium (MEDIUM); High (HIGH); Urgent (URGENT)","false","true","false","false","false","true","HubSpot","","20%","",""
"Time to close in SLA hours","hs_time_to_close_in_operating_hours","number","The time between when the ticket was created and closed. This time calculation accounts for the goals set up for your SLAs.","ticketinformation","false","","false","true","false","false","false","true","HubSpot","","0%","",""
"Time to first response in SLA hours","hs_time_to_first_response_in_operating_hours","number","The time between the ticket create date and the first agent reply. This time calculation accounts for the goals set up for your SLAs.","ticketinformation","false","","false","true","false","false","false","true","HubSpot","","0%","",""
"Updated by user ID","hs_updated_by_user_id","number","The user who last updated this record. This value is set automatically by HubSpot.","ticketinformation","false","","true","true","false","true","false","true","HubSpot","","100%","",""
"Ticket owner","hubspot_owner_id","enumeration","User the ticket is assigned to. Assign additional users to a ticket record by creating a custom user property.","ticketinformation","true","","false","true","false","true","false","true","HubSpot","","100%","",""
"HubSpot team","hubspot_team_id","enumeration","Primary team of the ticket owner. This property is set automatically by HubSpot.","ticketinformation","false","","true","true","false","true","false","true","HubSpot","","100%","",""
"Indexed Chain","indexed_chain","enumeration","Chain that the subgraph is indexing","ticketinformation","true","Ethereum; Polygon; Arbitrum; Optimism","false","false","false","false","false","false","E&N Developer Account Operations","","20%","",""
"Source","source_type","enumeration","Channel where ticket was originally submitted","ticketinformation","true","Chat (CHAT) [READ-ONLY]; Email (EMAIL) [READ-ONLY]; Form (FORM) [READ-ONLY]; Phone (PHONE)","false","true","false","false","false","true","HubSpot","","40%","",""
"Subgraph Deployment ID","subgraph_deployment_id","string","","ticketinformation","true","","false","false","false","false","false","false","E&N Developer Account Operations","","0%","",""
"Subgraph ID","subgraph_id","string","","ticketinformation","true","","false","false","false","false","false","false","E&N Developer Account Operations","","0%","",""
"Ticket name","subject","string","Short summary of ticket","ticketinformation","true","","false","true","false","false","false","true","HubSpot","","100%","",""
